<?xml version="1.0" encoding="UTF-8"?>
<Permit xmlns="http://www.iho.int/s100/se/5.0"
    xmlns:xsi="http://www.w3.org/2001/XMLSchema-instance"
    xsi:schemaLocation="http://www.iho.int/s100/se/5.0 https://schemas.s100dev.net/schemas/S100/5.0.0/S100SE/20220331/Part15.xsd">
    <header>
        <issueDate>2018-03-20Z</issueDate>
        <dataServerName>Primar</dataServerName>
        <dataServerIdentifier>PR</dataServerIdentifier>
        <version>1.0.0</version>
        <userpermit>267C3AD506E69B1ED18AA5ECC7FFDE6E7C330CE8859868</userpermit>
    </header>
    <products>
        <product id="S-101">
            <datasetPermit>
                <filename>101GB40079ABCDEF.000</filename>
                <editionNumber>10</editionNumber>
                <expiry>2022-12-31</expiry>
                <encryptedKey>2E16E07E451FF1854156634DA3DD3FB8</encryptedKey>
            </datasetPermit>
            <datasetPermit>
                <filename>101NO32802411223.000</filename>
                <editionNumber>5</editionNumber>
                <expiry>2022-06-10</expiry>
                <encryptedKey>C714B5C0FBDF14BFE4B1F12E62CE5FF6</encryptedKey>
            </datasetPermit>
        </product>
        <product id="S-102">
            <datasetPermit>
                <filename>102NO329048208.h5</filename>
                <editionNumber>1</editionNumber>
                <expiry>2022-12-31</expiry>
                <encryptedKey>50BBC28B6793E1C3966B45FB2932E1BE</encryptedKey>
            </datasetPermit>
        </product>
    </products>
</Permit>